<?xml version="1.0"?>
<!DOCTYPE plantTaxa SYSTEM "file:C:\plot_database\taxa.dtd">
<plantTaxa>

<!--
from plants 1996
ABBAL|Abies balsamea (L.) P. Mill. ssp. lasiocarpa (Hook.) Boivin|=Abies lasiocarpa var. lasiocarpa|Pinaceae
-->
	
	<name>
		<symbol>ABBAL</symbol>
		<taxon>Abies balsamea (L.) P. Mill. ssp. lasiocarpa (Hook.) Boivin</taxon> 
		<commonName>Abies lasiocarpa var. lasiocarpa</commonName>
		<family> Pinaceae </family>
		<entryDate>2000</entryDate>
		<nameReference>
			<author>Bovin</author>
			<dateEntered>2000</dateEntered>
			<citation>unknown, from plants 1996</citation>
			<label>Abies balsamea (L.) P. Mill. ssp. lasiocarpa (Hook.) Boivin</label> <!--enter species name form plants-->  
		</nameReference>
	</name>
	
	
	<circumscription>
		<type>No</type> <!--always No in the plants-->
		<circumReference>
			<author>Plants1996</author>  <!--plants year-->
			<dateEntered>2000</dateEntered>
			<citation>Plants 1996: plants.usda.gov</citation>  <!--plants year-->
			<label>Abies balsamea (L.) P. Mill. ssp. lasiocarpa (Hook.) Boivin</label>
		</circumReference>
	</circumscription>
	
	<party>
		<orgName>USDA</orgName>  <!--USDA-->
	</party>
	
	<status>
		<currentStatus>NS</currentStatus> <!--because there is an equal sign it is ns else std-->
		<statusParty>USDA</statusParty>  <!--USDA-->
		<startDate>1996</startDate> <!--1996-->
		<stopDate>null</stopDate> <!--no stop date for 96-->
	</status>
	
	
	<correlation>
		<correlationParty>USDA</correlationParty>
			<!--if equal sign (nonstandard) then this party is the USDA-->
			
		<correlationReference>
				<correlationAuthor>Plants1996</correlationAuthor>
				<correlationDateEntered>2000</correlationDateEntered>
				<correlationCitation>Plants 1996: plants.usda.gov</correlationCitation>
		 		<label>Abies lasiocarpa var. lasiocarpa</label> 
		</correlationReference>
		
		<congruence>equal</congruence> 
	</correlation>
	
	
</plantTaxa>
